{
  "schema": "specgen/spec/v1alpha2",
  "id": "example-minimal",
  "title": "Minimal example",
  "version": "0.1.1",
  "status": "draft",
  "state": {
    "kind": "current"
  },
  "snapshot": {
    "id": "SNAP-001",
    "sequence": 1,
    "created_at": "2026-08-27T00:00:00Z",
    "authoring_event_ids": []
  },
  "intent": {
    "problem": "Demonstrate the current canonical contract.",
    "objectives": [
      "Provide one minimal v1alpha2 example."
    ],
    "non_goals": [
      "Demonstrate the full future product model."
    ]
  },
  "scope": {
    "included": [
      "schema example"
    ],
    "excluded": []
  },
  "requirements": [],
  "interfaces": [],
  "data_contracts": [],
  "decisions": [],
  "acceptance_criteria": [],
  "evaluations": [],
  "implementation": {
    "tasks": [],
    "phases": []
  },
  "risks": [],
  "unresolved_questions": [],
  "traceability": [],
  "preservation": {
    "claims": []
  },
  "provenance": {
    "sources": []
  }
}
